chapter,paragraph_num,text
7,66,"Military weapons are the means used by the Sage to punish violence and cruelty, to give peace to troublous times, to remove difficulties and dangers, and to succour those who are in peril. Every animal with blood in its veins and horns on its head will fight when it is attacked. How much more so will man, who carries in his breast the faculties of love and hatred, joy and anger! When he is pleased, a feeling of affection springs up within him; when angry, his poisoned sting is brought into play."
7,67,The next piece is taken from Tu Mu’s preface to his commentary on Sun
7,68,"War may be defined as punishment, which is one of the functions of government. It was the profession of Chung Yu and Jan Ch’iu, both disciples of Confucius. Nowadays, the holding of trials and hearing of litigation, the imprisonment of offenders and their execution by flogging in the market-place, are all done by officials. But the wielding of huge armies, the throwing down of fortified cities, the hauling of women and children into captivity, and the beheading of traitors—this is also work whic"
7,69,"Chi-sun asked Jan Yu, saying: ""Have you, Sir, acquired your military aptitude by study, or is it innate?"" Jan Yu replied: ""It has been acquired by study."" [59] ""How can that be so,"" said Chi-sun, ""seeing that you are a disciple of Confucius?"" ""It is a fact,"" replied Jan Yu; ""I was taught by Confucius. It is fitting that the great Sage should exercise both civil and military functions, though to be sure my instruction in the art of fighting has not yet gone very far."" Now, who the author was of t"
7,70,"When the Duke of Chou was minister under Ch’eng Wang, he regulated ceremonies and made music, and venerated the arts of scholarship and learning; yet when the barbarians of the River Huai revolted, [60] he sallied forth and chastised them. When Confucius held office under the Duke of Lu, and a meeting was convened at Chia-ku, [61] he said: ""If pacific negotiations are in progress, warlike preparations should have been made beforehand."" He rebuked and shamed the Marquis of Ch’i, who cowered under"
8,71,"Sun Hsing-yen, the editor of Sun Tzŭ, writes in similar strain:— Confucius said: ""I am unversed in military matters."" [65] He also said: ""If I fight, I conquer."" Confucius ordered ceremonies and regulated music. Now war constitutes one of the five classes of State ceremonial, [66] and must not be treated as an independent branch of study. Hence, the words ""I am unversed in"" must be taken to mean that there are things which even an inspired Teacher does not know. Those who have to lead an army an"
8,72,"The following are the oldest Chinese treatises on war, after Sun Tzŭ. The notes on each have been drawn principally from the _Ssu k’u ch’uan shu chien ming mu lu_, ch. 9, fol. 22 sqq. 1. _Wu Tzŭ_, in 1 _chuan_ or 6 chapters. By Wu Ch’i (_d_. 381 B.C.). A"
8,73,"2. _Ssu-ma Fa_, in 1 _chuan_ or 5 chapters. Wrongly attributed to Ssu-ma Jang-chu of the 6th century B.C. Its date, however, must be early, as the customs of the three ancient dynasties are constantly to be met within its pages. See _Shih Chi_, ch. 64. The _Ssu K’u Ch’uan Shu_ (ch. 99, f. 1) remarks that the oldest three treatises on war, _Sun Tzŭ_, _Wu Tzŭ_ and _Ssu-ma Fa_, are, generally speaking, only concerned with things strictly military—the art of producing, collecting, training and drill"
8,74,"3. _Liu T’ao_, in 6 _chuan_, or 60 chapters. Attributed to Lu Wang (or Lu Shang, also known as T’ai Kung) of the 12th century B.C. [74] But its style does not belong to the era of the Three Dynasties. Lu Te-ming (550-625 A.D.) mentions the work, and enumerates the headings of the six sections so that the forgery cannot have been later than Sui"
8,75,"4. _Wei Liao Tzŭ_, in 5 _chuan_. Attributed to Wei Liao (4th cent. B.C.), who studied under the famous Kuei-ku Tzŭ. The work appears to have been originally in 31 chapters, whereas the text we possess contains only 24. Its matter is sound enough in the main, though the strategical devices differ considerably from those of the Warring States period. It is been furnished with a commentary by the well-known"
8,76,"5. _San Lueh_ in 3 _chuan_. Attributed to Huang-shih Kung, a legendary personage who is said to have bestowed it on Chang Liang (_d_. 187 B.C.) in an interview on a bridge. But here again, the style is not that of works dating from the Ch’in or Han period. The Han Emperor Kuang Wu [25-57 A.D.] apparently quotes from it in one of his proclamations; but the passage in question may have been inserted later on, in order to prove the genuineness of the work. We shall not be far out if we refer it to "
8,77,"6. _Li Wei Kung Wen Tui_, in 3 sections. Written in the form of a dialogue between T’ai Tsung and his great general Li Ching, it is usually ascribed to the latter. Competent authorities consider it a forgery, though the author was evidently well versed in the art of war. 7. _Li Ching Ping Fa_ (not to be confounded with the foregoing) is a short treatise in 8 chapters, preserved in the T’ung Tien, but not published separately. This fact explains its omission from the _Ssu K’u"
8,78,"8. _Wu Ch’i Ching_, in 1 _chuan_. Attributed to the legendary minister Feng Hou, with exegetical notes by Kung-sun Hung of the Han dynasty (_d_. 121 B.C.), and said to have been eulogized by the celebrated general Ma Lung (_d_. 300 A.D.). Yet the earliest mention of it is in the _Sung Chih_. Although a forgery, the work is well put together. Considering the high popular estimation in which Chu-ko Liang has always been held, it is not surprising to find more than one work on war ascribed to his p"
8,79,"_T’ung Tien_ (circa 800 A.D.), ch. 148-162."
8,80,"_Wen Hsien Tung K’ao_ (13th cent.), ch. 221."
9,81,"_Yuan Chien Lei Han_ (1710), ch. 206-229. _Ku Chin T’u Shu Chi Ch’eng_ (1726), section XXX, esp. ch. 81-90. _Hsu Wen Hsien T’ung K’ao_ (1784), ch. 121-134. _Huang Ch’ao Ching Shih Wen Pien_ (1826), ch. 76, 77. The bibliographical sections of certain historical works also deserve"
9,82,To these of course must be added the great Catalogue of the Imperial
9,83,"_Ssu K’u Ch’uan Shu Tsung Mu T’i Yao_ (1790), ch. 99, 100."
9,84,"7. The appellation of Hu Yen, mentioned in ch. 39 under the year 637."
9,85,"9. The mistake is natural enough. Native critics refer to a work of the Han dynasty, which says: ""Ten _li_ outside the _Wu_ gate [of the city of Wu, now Soochow in Kiangsu] there is a great mound, raised to commemorate the entertainment of Sun Wu of Ch’i, who excelled in the"
9,86,"10. ""They attached strings to wood to make bows, and sharpened wood to make arrows. The use of bows and arrows is to keep the Empire in awe."" 11. The son and successor of Ho Lu. He was finally defeated and overthrown by Kou chien, King of Yüeh, in 473 B.C. See post. 12. King Yen of Hsu, a fabulous being, of whom Sun Hsing-yen says in his preface: ""His humanity brought him to destruction."" 13. The passage I have put in brackets is omitted in the _T’u Shu_, and may be an interpolation. It was know"
9,87,"16. On the other hand, it is noteworthy that _Wu Tzŭ_, which is not in 6 chapters, has 48 assigned to it in the _Han Chih_. Likewise, the _Chung Yung_ is credited with 49 chapters, though now only in one only. In the case of very short works, one is tempted to think that _p’ien_"
9,88,"17. Yeh Shih of the Sung dynasty [1151-1223]. 18. He hardly deserves to be bracketed with assassins. 19. See Chapter 7, § 27 and Chapter 11, § 28. 20. See Chapter 11, § 28. Chuan Chu is the abbreviated form of his"
9,89,"22. The nucleus of this work is probably genuine, though large additions have been made by later hands. Kuan chung died in 645 B.C. 23. See infra, beginning of INTRODUCTION. 24. I do not know what this work, unless it be the last chapter of another work. Why that chapter should be singled out, however, is not"
9,90,"26. That is, I suppose, the age of Wu Wang and Chou Kung."
10,91,"28. Ssu-ma Jang-chu, whose family name was T’ien, lived in the latter half of the 6th century B.C., and is also believed to have written a work on war. See _Shih Chi_, ch. 64, and infra at the beginning of the"
10,92,"29. See Legge’s Classics, vol. V, Prolegomena p. 27. Legge thinks that the _Tso Chuan_ must have been written in the 5th century, but not"
10,93,"31. When Wu first appears in the _Ch’un Ch’iu_ in 584, it is already at variance with its powerful neighbour. The _Ch’un Ch’iu_ first mentions"
10,94,"32. This is explicitly stated in the _Tso Chuan_, XXXII, 2. 33. There is this to be said for the later period, that the feud would tend to grow more bitter after each encounter, and thus more fully"
10,95,"34. With Wu Yuan himself the case is just the reverse:—a spurious treatise on war has been fathered on him simply because he was a great general. Here we have an obvious inducement to forgery. Sun Wu, on the other hand, cannot have been widely known to fame in the 5th century. 35. From _Tso Chuan:_ ""From the date of King Chao’s accession [515] there was no year in which Ch’u was not attacked by Wu."" 36. Preface ad fin: ""My family comes from Lo-an, and we are really descended from Sun Tzŭ. I am a"
10,96,"37. Hoa-yin is about 14 miles from T’ung-kuan on the eastern border of Shensi. The temple in question is still visited by those about the ascent of the Western Sacred Mountain. It is mentioned in a text as being ""situated five _li_ east of the district city of Hua-yin. The temple contains the Hua-shan tablet inscribed by the T’ang Emperor"
10,97,"38. See my ""Catalogue of Chinese Books"" (Luzac & Co., 1908), no. 40. 39. This is a discussion of 29 difficult passages in Sun Tzŭ. 40. Cf. Catalogue of the library of Fan family at Ningpo: ""His commentary is frequently obscure; it furnishes a clue, but does not"
10,98,"42. It is interesting to note that M. Pelliot has recently discovered chapters 1, 4 and 5 of this lost work in the ""Grottos of the Thousand Buddhas."" See B.E.F.E.O., t. VIII, nos. 3-4, p. 525. 43. The Hsia, the Shang and the Chou. Although the last-named was nominally existent in Sun Tzŭ’s day, it retained hardly a vestige of power, and the old military organization had practically gone by the board. I can suggest no other explanation of the passage."
10,99,"46. This appears to be still extant. See Wylie’s ""Notes,"" p. 91 (new"
10,100,48. A notable person in his day. His biography is given in the _San Kuo
11,101,"53. The few Europeans who have yet had an opportunity of acquainting themselves with Sun Tzŭ are not behindhand in their praise. In this connection, I may perhaps be excused for quoting from a letter from Lord Roberts, to whom the sheets of the present work were submitted previous to publication: ""Many of Sun Wu’s maxims are perfectly applicable to the present day, and no. 11 [in Chapter VIII] is one that the people of this country would do well to take to heart."""
11,102,56. The allusion may be to Mencius VI. 2. ix. 2.
11,103,"66. The other four being worship, mourning, entertainment of guests, and festive rites. See _Shu Ching_, ii. 1. III. 8, and _Chou Li_, IX."
11,104,"68. This is a rather obscure allusion to the _Tso Chuan_, where Tzŭ-ch’an says: ""If you have a piece of beautiful brocade, you will not"
11,105,"70. Sun Hsing-yen might have quoted Confucius again. See _Lun Yu_,"
11,106,71. Better known as Hsiang Yu [233-202 B.C.].
11,107,"74. See XIII. § 27, note. Further details on T’ai Kung will be found in the _Shih Chi_, ch. 32 ad init. Besides the tradition which makes him a former minister of Chou Hsin, two other accounts of him are there given, according to which he would appear to have been first raised from a humble private station by Wen Wang."
11,108,"[Ts’ao Kung, in defining the meaning of the Chinese for the title of this chapter, says it refers to the deliberations in the temple selected by the general for his temporary use, or as we should say, in"
11,109,"1. Sun Tzŭ said: The art of war is of vital importance to the State. 2. It is a matter of life and death, a road either to safety or to ruin. Hence it is a subject of inquiry which can on no account be"
11,110,"3. The art of war, then, is governed by five constant factors, to be taken into account in one’s deliberations, when seeking to determine"
12,111,4. These are: (1) The Moral Law; (2) Heaven; (3) Earth; (4) The
12,112,"[It appears from what follows that Sun Tzŭ means by ""Moral Law"" a principle of harmony, not unlike the Tao of Lao Tzŭ in its moral aspect. One might be tempted to render it by ""morale,"" were it not considered as an attribute of the _ruler_ in § 13.] 5, 6. _The Moral Law_ causes the people to be in complete accord with their ruler, so that they will follow him regardless of their lives,"
12,113,"[Tu Yu quotes Wang Tzŭ as saying: ""Without constant practice, the officers will be nervous and undecided when mustering for battle; without constant practice, the general will be wavering and irresolute"
12,114,"7. _Heaven_ signifies night and day, cold and heat, times and seasons. [The commentators, I think, make an unnecessary mystery of two words here. Meng Shih refers to ""the hard and the soft, waxing and waning"" of Heaven. Wang Hsi, however, may be right in saying that what is meant is ""the general economy of Heaven,"" including the five elements, the four seasons, wind and clouds, and other phenomena.] 8. _Earth_ comprises distances, great and small; danger and security; open ground and narrow pass"
12,115,"[The five cardinal virtues of the Chinese are (1) humanity or benevolence; (2) uprightness of mind; (3) self-respect, self-control, or ""proper feeling;"" (4) wisdom; (5) sincerity or good faith. Here ""wisdom"" and ""sincerity"" are put before ""humanity or benevolence,"" and the two military virtues of ""courage"" and ""strictness"" substituted for ""uprightness of mind"" and ""self-respect, self-control, or ‘proper"
12,116,"10. By _Method and discipline_ are to be understood the marshalling of the army in its proper subdivisions, the gradations of rank among the officers, the maintenance of roads by which supplies may reach the army, and the control of military expenditure. 11. These five heads should be familiar to every general: he who knows them will be victorious; he who knows them not will fail. 12. Therefore, in your deliberations, when seeking to determine the military conditions, let them be made the basis "
12,117,"13. (1) Which of the two sovereigns is imbued with the Moral law? [I.e., ""is in harmony with his subjects."" Cf. § 5.] (2) Which of the two generals has most ability? (3) With whom lie the advantages derived from Heaven and Earth?"
12,118,"(4) On which side is discipline most rigorously enforced? [Tu Mu alludes to the remarkable story of Ts’ao Ts’ao (A.D. 155-220), who was such a strict disciplinarian that once, in accordance with his own severe regulations against injury to standing crops, he condemned himself to death for having allowed his horse to shy into a field of corn! However, in lieu of losing his head, he was persuaded to satisfy his sense of justice by cutting off his hair. Ts’ao Ts’ao’s own comment on the present pass"
12,119,"[Morally as well as physically. As Mei Yao-ch’en puts it, freely rendered, ""_esprit de corps_ and ‘big battalions.’""] (6) On which side are officers and men more highly trained? [Tu Yu quotes Wang Tzŭ as saying: ""Without constant practice, the officers will be nervous and undecided when mustering for battle; without constant practice, the general will be wavering and irresolute"
12,120,(7) In which army is there the greater constancy both in reward and
13,121,[On which side is there the most absolute certainty that merit will be properly rewarded and misdeeds summarily punished?] 14. By means of these seven considerations I can forecast victory or
13,122,"15. The general that hearkens to my counsel and acts upon it, will conquer:—let such a one be retained in command! The general that hearkens not to my counsel nor acts upon it, will suffer defeat:—let"
13,123,"[The form of this paragraph reminds us that Sun Tzŭ’s treatise was composed expressly for the benefit of his patron Ho Lu, king of the Wu"
13,124,"16. While heeding the profit of my counsel, avail yourself also of any helpful circumstances over and beyond the ordinary rules. 17. According as circumstances are favourable, one should modify one’s"
13,125,"[Sun Tzŭ, as a practical soldier, will have none of the ""bookish theoric."" He cautions us here not to pin our faith to abstract principles; ""for,"" as Chang Yu puts it, ""while the main laws of strategy can be stated clearly enough for the benefit of all and sundry, you must be guided by the actions of the enemy in attempting to secure a favourable position in actual warfare."" On the eve of the battle of Waterloo, Lord Uxbridge, commanding the cavalry, went to the Duke of Wellington in order to le"
13,126,"[The truth of this pithy and profound saying will be admitted by every soldier. Col. Henderson tells us that Wellington, great in so many military qualities, was especially distinguished by ""the extraordinary skill with which he concealed his movements and deceived both friend"
13,127,"19. Hence, when able to attack, we must seem unable; when using our forces, we must seem inactive; when we are near, we must make the enemy believe we are far away; when far away, we must make him believe we are"
13,128,"20. Hold out baits to entice the enemy. Feign disorder, and crush him. [All commentators, except Chang Yu, say, ""When he is in disorder, crush him."" It is more natural to suppose that Sun Tzŭ is still illustrating"
13,129,"21. If he is secure at all points, be prepared for him. If he is in"
13,130,"22. If your opponent is of choleric temper, seek to irritate him. Pretend to be weak, that he may grow arrogant. [Wang Tzŭ, quoted by Tu Yu, says that the good tactician plays with his adversary as a cat plays with a mouse, first feigning weakness and immobility, and then suddenly pouncing upon him.] 23. If he is taking his ease, give him no rest. [This is probably the meaning though Mei Yao-ch’en has the note: ""while we are taking our ease, wait for the enemy to tire himself out."" The _Yu Lan_ "
14,131,"[Less plausible is the interpretation favoured by most of the commentators: ""If sovereign and subject are in accord, put division"
14,132,"24. Attack him where he is unprepared, appear where you are not"
14,133,"25. These military devices, leading to victory, must not be divulged"
14,134,26. Now the general who wins a battle makes many calculations in his
14,135,"[Chang Yu tells us that in ancient times it was customary for a temple to be set apart for the use of a general who was about to take the field, in order that he might there elaborate his plan of campaign.] The general who loses a battle makes but few calculations beforehand. Thus do many calculations lead to victory, and few calculations to defeat: how much more no calculation at all! It is by attention to this point that I can foresee who is likely to win or lose. [1] ""Words on Wellington,"" by"
14,136,"[Ts’ao Kung has the note: ""He who wishes to fight must first count the cost,"" which prepares us for the discovery that the subject of the chapter is not what we might expect from the title, but is primarily a"
14,137,"1. Sun Tzŭ said: In the operations of war, where there are in the field a thousand swift chariots, as many heavy chariots, and a hundred"
14,138,"[The ""swift chariots"" were lightly built and, according to Chang Yu, used for the attack; the ""heavy chariots"" were heavier, and designed for purposes of defence. Li Ch’uan, it is true, says that the latter were light, but this seems hardly probable. It is interesting to note the analogies between early Chinese warfare and that of the Homeric Greeks. In each case, the war-chariot was the important factor, forming as it did the nucleus round which was grouped a certain number of foot-soldiers. Wi"
14,139,"with provisions enough to carry them a thousand _li_, [2.78 modern _li_ go to a mile. The length may have varied slightly"
14,140,"the expenditure at home and at the front, including entertainment of guests, small items such as glue and paint, and sums spent on chariots and armour, will reach the total of a thousand ounces of silver per day. Such is the cost of raising an army of 100,000 men. 2. When you engage in actual fighting, if victory is long in coming, the men’s weapons will grow dull and their ardour will be damped. If you lay siege to a town, you will exhaust your strength. 3. Again, if the campaign is protracted,"
15,141,"4. Now, when your weapons are dulled, your ardour damped, your strength exhausted and your treasure spent, other chieftains will spring up to take advantage of your extremity. Then no man, however wise, will be able to avert the consequences that must ensue. 5. Thus, though we have heard of stupid haste in war, cleverness has never been seen associated with long delays. [This concise and difficult sentence is not well explained by any of the commentators. Ts’ao Kung, Li Ch’uan, Meng Shih, Tu Yu,"
15,142,6. There is no instance of a country having benefited from prolonged
15,143,"7. It is only one who is thoroughly acquainted with the evils of war that can thoroughly understand the profitable way of carrying it on. [That is, with rapidity. Only one who knows the disastrous effects of a long war can realize the supreme importance of rapidity in bringing it to a close. Only two commentators seem to favour this interpretation, but it fits well into the logic of the context, whereas the rendering, ""He who does not know the evils of war cannot appreciate its benefits,"""
15,144,"8. The skilful soldier does not raise a second levy, neither are his"
15,145,"[Once war is declared, he will not waste precious time in waiting for reinforcements, nor will he return his army back for fresh supplies, but crosses the enemy’s frontier without delay. This may seem an audacious policy to recommend, but with all great strategists, from Julius Caesar to Napoleon Bonaparte, the value of time—that is, being a little ahead of your opponent—has counted for more than either numerical superiority or the nicest calculations with regard to"
15,146,"9. Bring war material with you from home, but forage on the enemy. Thus the army will have food enough for its needs. [The Chinese word translated here as ""war material"" literally means ""things to be used"", and is meant in the widest sense. It includes all the impedimenta of an army, apart from provisions.] 10. Poverty of the State exchequer causes an army to be maintained by contributions from a distance. Contributing to maintain an army at a distance causes the people to be impoverished. [The "
15,147,"12. When their substance is drained away, the peasantry will be"
15,148,"13, 14. With this loss of substance and exhaustion of strength, the homes of the people will be stripped bare, and three-tenths of their"
15,149,"[Tu Mu and Wang Hsi agree that the people are not mulcted not of 3/10, but of 7/10, of their income. But this is hardly to be extracted from our text. Ho Shih has a characteristic tag: ""The _people_ being regarded as the essential part of the State, and _food_ as the people’s heaven, is it not right that those in authority should value and be"
15,150,"while Government expenses for broken chariots, worn-out horses, breast-plates and helmets, bows and arrows, spears and shields, protective mantlets, draught-oxen and heavy waggons, will amount to"
16,151,"15. Hence a wise general makes a point of foraging on the enemy. One cartload of the enemy’s provisions is equivalent to twenty of one’s own, and likewise a single _picul_ of his provender is equivalent to"
16,152,[Because twenty cartloads will be consumed in the process of transporting one cartload to the front. A _picul_ is a unit of measure
16,153,"16. Now in order to kill the enemy, our men must be roused to anger; that there may be advantage from defeating the enemy, they must have"
16,154,"[Tu Mu says: ""Rewards are necessary in order to make the soldiers see the advantage of beating the enemy; thus, when you capture spoils from the enemy, they must be used as rewards, so that all your men may have a keen desire to fight, each on his own account.""] 17. Therefore in chariot fighting, when ten or more chariots have been taken, those should be rewarded who took the first. Our own flags should be substituted for those of the enemy, and the chariots mingled and used in conjunction with "
16,155,"18. This is called, using the conquered foe to augment one’s own"
16,156,"19. In war, then, let your great object be victory, not lengthy"
16,157,"[As Ho Shih remarks: ""War is not a thing to be trifled with."" Sun Tzŭ here reiterates the main lesson which this chapter is intended to"
16,158,"20. Thus it may be known that the leader of armies is the arbiter of the people’s fate, the man on whom it depends whether the nation shall"
16,159,"1. Sun Tzŭ said: In the practical art of war, the best thing of all is to take the enemy’s country whole and intact; to shatter and destroy it is not so good. So, too, it is better to capture an army entire than to destroy it, to capture a regiment, a detachment or a company entire"
