chapter,paragraph_num,text
16,160,"[The equivalent to an army corps, according to Ssu-ma Fa, consisted nominally of 12500 men; according to Ts’ao Kung, the equivalent of a regiment contained 500 men, the equivalent to a detachment consists from any number between 100 and 500, and the equivalent of a company contains from 5 to 100 men. For the last two, however, Chang Yu gives the exact figures of 100 and 5 respectively.] 2. Hence to fight and conquer in all your battles is not supreme excellence; supreme excellence consists in br"
17,161,"[Here again, no modern strategist but will approve the words of the old Chinese general. Moltke’s greatest triumph, the capitulation of the huge French army at Sedan, was won practically without bloodshed.] 3. Thus the highest form of generalship is to baulk the enemy’s plans; [Perhaps the word ""balk"" falls short of expressing the full force of the Chinese word, which implies not an attitude of defence, whereby one might be content to foil the enemy’s stratagems one after another, but an active "
17,162,"and the worst policy of all is to besiege walled cities. 4. The rule is, not to besiege walled cities if it can possibly be"
17,163,"[Another sound piece of military theory. Had the Boers acted upon it in 1899, and refrained from dissipating their strength before Kimberley, Mafeking, or even Ladysmith, it is more than probable that they would have been masters of the situation before the British were ready"
17,164,"The preparation of mantlets, movable shelters, and various implements"
17,165,"[It is not quite clear what the Chinese word, here translated as ""mantlets"", described. Ts’ao Kung simply defines them as ""large shields,"" but we get a better idea of them from Li Ch’uan, who says they were to protect the heads of those who were assaulting the city walls at close quarters. This seems to suggest a sort of Roman _testudo_, ready made. Tu Mu says they were wheeled vehicles used in repelling attacks, but this is denied by Ch’en Hao. See _supra_ II. 14. The name is also applied to tu"
17,166,and the piling up of mounds over against the walls will take three
17,167,"[These were great mounds or ramparts of earth heaped up to the level of the enemy’s walls in order to discover the weak points in the defence, and also to destroy the fortified turrets mentioned in the preceding"
17,168,"5. The general, unable to control his irritation, will launch his men"
17,169,"[This vivid simile of Ts’ao Kung is taken from the spectacle of an army of ants climbing a wall. The meaning is that the general, losing patience at the long delay, may make a premature attempt to storm the place before his engines of war are ready.] with the result that one-third of his men are slain, while the town still remains untaken. Such are the disastrous effects of a siege. [We are reminded of the terrible losses of the Japanese before Port Arthur, in the most recent siege which history"
17,170,"7. With his forces intact he will dispute the mastery of the Empire, and thus, without losing a man, his triumph will be complete. [Owing to the double meanings in the Chinese text, the latter part of the sentence is susceptible of quite a different meaning: ""And thus, the weapon not being blunted by use, its keenness remains perfect.""] This is the method of attacking by stratagem. 8. It is the rule in war, if our forces are ten to the enemy’s one, to surround him; if five to one, to attack him;"
18,171,"9. If equally matched, we can offer battle; [Li Ch’uan, followed by Ho Shih, gives the following paraphrase: ""If attackers and attacked are equally matched in strength, only the able"
18,172,"if slightly inferior in numbers, we can avoid the enemy; [The meaning, ""we can _watch_ the enemy,"" is certainly a great improvement on the above; but unfortunately there appears to be no very good authority for the variant. Chang Yu reminds us that the saying only applies if the other factors are equal; a small difference in numbers is often more than counterbalanced by superior energy and"
18,173,"if quite unequal in every way, we can flee from him. 10. Hence, though an obstinate fight may be made by a small force, in the end it must be captured by the larger force. 11. Now the general is the bulwark of the State: if the bulwark is complete at all points; the State will be strong; if the bulwark is"
18,174,"[As Li Ch’uan tersely puts it: ""Gap indicates deficiency; if the general’s ability is not perfect (i.e. if he is not thoroughly versed in his profession), his army will lack strength.""] 12. There are three ways in which a ruler can bring misfortune upon his"
18,175,"13. (1) By commanding the army to advance or to retreat, being ignorant of the fact that it cannot obey. This is called hobbling the army. [Li Ch’uan adds the comment: ""It is like tying together the legs of a thoroughbred, so that it is unable to gallop."" One would naturally think of ""the ruler"" in this passage as being at home, and trying to direct the movements of his army from a distance. But the commentators understand just the reverse, and quote the saying of T’ai Kung: ""A kingdom should no"
18,176,"14. (2) By attempting to govern an army in the same way as he administers a kingdom, being ignorant of the conditions which obtain in an army. This causes restlessness in the soldier’s minds. [Ts’ao Kung’s note is, freely translated: ""The military sphere and the civil sphere are wholly distinct; you can’t handle an army in kid gloves."" And Chang Yu says: ""Humanity and justice are the principles on which to govern a state, but not an army; opportunism and flexibility, on the other hand, are milit"
18,177,"16. But when the army is restless and distrustful, trouble is sure to come from the other feudal princes. This is simply bringing anarchy into the army, and flinging victory away. 17. Thus we may know that there are five essentials for victory: (1) He will win who knows when to fight and when not to fight. [Chang Yu says: If he can fight, he advances and takes the offensive; if he cannot fight, he retreats and remains on the defensive. He will invariably conquer who knows whether it is right to "
18,178,(2) He will win who knows how to handle both superior and inferior
18,179,"[This is not merely the general’s ability to estimate numbers correctly, as Li Ch’uan and others make out. Chang Yu expounds the saying more satisfactorily: ""By applying the art of war, it is possible with a lesser force to defeat a greater, and _vice versa_. The secret lies in an eye for locality, and in not letting the right moment slip. Thus Wu Tzŭ says: ‘With a superior force, make for easy ground; with an inferior one, make for difficult ground.’""] (3) He will win whose army is animated by "
18,180,"(4) He will win who, prepared himself, waits to take the enemy"
19,181,(5) He will win who has military capacity and is not interfered with by
19,182,"[Tu Yu quotes Wang Tzŭ as saying: ""It is the sovereign’s function to give broad instructions, but to decide on battle it is the function of the general."" It is needless to dilate on the military disasters which have been caused by undue interference with operations in the field on the part of the home government. Napoleon undoubtedly owed much of his extraordinary success to the fact that he was not hampered by central"
19,183,"Victory lies in the knowledge of these five points. [Literally, “These five things are knowledge of the principle of"
19,184,"18. Hence the saying: If you know the enemy and know yourself, you need not fear the result of a hundred battles. If you know yourself but not the enemy, for every victory gained you will also suffer a defeat. [Li Ch’uan cites the case of Fu Chien, prince of Ch’in, who in 383 A.D. marched with a vast army against the Chin Emperor. When warned not to despise an enemy who could command the services of such men as Hsieh An and Huan Ch’ung, he boastfully replied: ""I have the population of eight prov"
19,185,"[Chang Yu said: ""Knowing the enemy enables you to take the offensive, knowing yourself enables you to stand on the defensive."" He adds: ""Attack is the secret of defence; defence is the planning of an attack."" It would be hard to find a better epitome of the"
19,186,"[Ts’ao Kung explains the Chinese meaning of the words for the title of this chapter: ""marching and countermarching on the part of the two armies with a view to discovering each other’s condition."" Tu Mu says: ""It is through the dispositions of an army that its condition may be discovered. Conceal your dispositions, and your condition will remain secret, which leads to victory; show your dispositions, and your condition will become patent, which leads to defeat."" Wang Hsi remarks that the good ge"
19,187,"1. Sun Tzŭ said: The good fighters of old first put themselves beyond the possibility of defeat, and then waited for an opportunity of"
19,188,"2. To secure ourselves against defeat lies in our own hands, but the opportunity of defeating the enemy is provided by the enemy himself. [That is, of course, by a mistake on the enemy’s part.] 3. Thus the good fighter is able to secure himself against defeat, [Chang Yu says this is done, ""By concealing the disposition of his troops, covering up his tracks, and taking unremitting precautions.""] but cannot make certain of defeating the enemy. 4. Hence the saying: One may _know_ how to conquer wit"
19,189,5. Security against defeat implies defensive tactics; ability to defeat
19,190,"[I retain the sense found in a similar passage in §§ 1-3, in spite of the fact that the commentators are all against me. The meaning they give, ""He who cannot conquer takes the defensive,"" is plausible"
20,191,6. Standing on the defensive indicates insufficient strength;
20,192,7. The general who is skilled in defence hides in the most secret
20,193,"[Literally, ""hides under the ninth earth,"" which is a metaphor indicating the utmost secrecy and concealment, so that the enemy may"
20,194,he who is skilled in attack flashes forth from the topmost heights of
20,195,"[Another metaphor, implying that he falls on his adversary like a thunderbolt, against which there is no time to prepare. This is the"
20,196,Thus on the one hand we have ability to protect ourselves; on the
20,197,8. To see victory only when it is within the ken of the common herd is
20,198,"[As Ts’ao Kung remarks, ""the thing is to see the plant before it has germinated,"" to foresee the event before the action has begun. Li Ch’uan alludes to the story of Han Hsin who, when about to attack the vastly superior army of Chao, which was strongly entrenched in the city of Ch’eng-an, said to his officers: ""Gentlemen, we are going to annihilate the enemy, and shall meet again at dinner."" The officers hardly took his words seriously, and gave a very dubious assent. But Han Hsin had already w"
20,199,"[True excellence being, as Tu Mu says: ""To plan secretly, to move surreptitiously, to foil the enemy’s intentions and balk his schemes, so that at last the day may be won without shedding a drop of blood."" Sun Tzŭ reserves his approbation for things that"
20,200,"10. To lift an autumn hair is no sign of great strength; [""Autumn hair"" is explained as the fur of a hare, which is finest in autumn, when it begins to grow afresh. The phrase is a very common one"
